disaster,month,year,status,disaster_type,affected_country,description,reference
Armenia: Hailstorms ,Jun,2023,Past Disaster,Flood1 more,Armenia,"Severe hailstorms struck various regions of Armenia, causing extensive damage and disruption. On 15 June 2023, the South region, particularly rural communities near the border, experienced heavy precipitation that overwhelmed sewage systems, flooded streets and houses, and rendered roads and bridges impassable. The hail and subsequent flooding resulted in significant damage to houses, livestock, gardens, and food stocks. The impact of the storms extended to other regions as well. On 18 June, Gyumri and neighbouring villages in the Shirak region were hit by a hailstorm, followed by heavy rainfall in Ijevan and neighboring villages in the Tavush region on 19 June. Furthermore, the Lori region experienced heavy rain on 19 and 20 June, affecting rural areas near Stepanavan. These events led to road destruction, disruptions in energy and water supply, and other infrastructure damages. The Tavush Regional Rescue Department Crisis Management Center received numerous alerts on 19 June, reporting significant damage caused by heavy rain, hail, and wind in Ijevan, Tavush. Uprooted trees, flooded roads and buildings, damaged roofs, and disruptions in power and gas supply networks were observed. Crop gardens and fields were also affected, leading to accidents in utility and energy systems. Committees were formed in Tavush Marz and Ijevan municipalities to assess the extent of the damage [...] The damage of the disaster within the two regions is the following: A total of 1,224 people were affected in Tavush, located in the northeast of Armenia, sharing borders with Georgia and Azerbaijan, and Gegharkunik, Kotayk, and Lori provinces internally. The town of Ijevan, the capital of Tavush, mainly suffered the consequences of the hailstorm. A total of 1,720 people were affected in Lori, which is situated in the northern part of Armenia, sharing a border with Georgia. A total of 12,500 people were affected by the hailstorm in Syunik and Shirak areas. (IFRC, 30 Jun 2023)On 2 August the severe hailstorm struck another part of the targeted Lori region, the Alaverdi community. The heavy hail started at 8 p.m. local time, and continued until 8.30 p.m., followed by rain and wind. The disaster mainly affected the urban area of Alaverdi and rural areas near the city. On the following day, Head of the Municipality sent a formal letter to ARCS with the request to support the most vulnerable, as the burden on the Municipality has been extensive. [...] The recent hailstorms had a significant impact on four regions of Armenia: Syunik, Shirak, Lori, and Tavush. These regions have experienced recurrent hailstorms, landslides, and floods due to climate change, resulting in severe agricultural losses. The recent events have heightened the threats faced by vulnerable population groups, particularly in communities already burdened by the recent conflict and its aftermath. The current DREF operation
has been focusing on supporting affected population in Lori and Tavush regions; the new allocation will target a new community in Lori region, where an overall 18,000 people were affected. (IFRC, 29 Aug 2023)",https://reliefweb.int/disaster/st-2023-000106-arm
Ecuador: Floods ,Jun,2023,Past Disaster,Flash Flood2 more,Ecuador,"On June 3, heavy rains were recorded in the provinces of Esmeraldas, resulting in the overflow of seven rivers in five local districts. The most affected areas include the districts of Atacames, Esmeraldas, Musine, Quinindé, and Rioverde. (WFP, 9 June 2023)The number of evacuated and affected people has been increasing following torrential rain and floods that hit the Province of Esmeraldas in north-western Ecuador in the past few days. At least six rivers overflowed across the cantons of Atacames, Esmeraldas, Quinindé and Muisne, all in the same Province. According to the Ecuador Risk Communication Management Department (SGR), 842 people have been sheltered, 14,186 affected, and almost 1,500 rescued. In addition, 2,895 houses have been impacted, as well as 21 educational facilities and seven health centres. The humanitarian assistance conducted by the national authorities is still ongoing. (ECHO, 7 Jun 2023)",https://reliefweb.int/disaster/fl-2023-000094-ecu
Haiti: Floods and Landslides ,Jun,2023,Past Disaster,Flood1 more,Haiti,"On 3 June, heavy rainfall hit the departments of Ouest, Nippes, Sud-Est, Nord-Ouest and Centre causing floods, triggering landslides and resulting in casualties and damage. According to the Haitian Civil Protection, 15 people died, eight are missing, almost 13,400 people have been displaced, 7,475 families affected (5,510 in the Ouest Department), and more than 1,200 houses flooded. Emergency response teams have been mobilised to provide support for the affected communities and to assess the damage. For the next 24 hours, light rain is expected across most parts of the country. (ECHO, 5 Jun 2023)On 3 June 2023, a low-pressure system caused torrential rains across the country. Most departments experienced severe flooding, rockslides and landslides. According to the DGPC, the provisional toll from the extreme weather is 37,375 people affected (including 13,390 displaced), 15 dead, 8 missing, 1,219 houses flooded and 160 destroyed or damaged. The General Directorate of Civil Protection (DGPC) activated the National Emergency Operations Centre (COUN) on 3 June. (OCHA, 5 Jun 2023)Following the heavy rain, strong winds, floods and landslides that affected most of Haiti on 2-3 June, the number of casualties and damage is increasing.
According to the Haitian Civil Protection, 42 people died, 11 are missing, and 85 have been injured. Moreover, 6,334 people have been evacuated, almost 12,800 families were affected, 13,500 houses flooded and several roads were destroyed. In the Departments of West, North-East and North-West, most of the rivers overflowed, while in Ouest Department, where 19 people died, five municipalities have been hardly impacted by widespread floods.  (ECHO, 6 Jun 2023)The DGPC's provisional figures for the storms now show 39,458 households affected, 3,586 people evacuated, 51 deaths, 140 people injured, 31,591 homes flooded and 2,445 homes destroyed or damaged. (OCHA, 6 Jun 2023)On 3 June Haiti experienced intense rainfall due to a stationary low-pressure system. The torrential rains caused flooding and landslides in 7 of the country's 10 departments. According to the Humanitarian Overview published by OCHA, 27 of the country's 146 communes were affected, leaving 58 people dead, 143 injured, 9,100 displaced and almost 45,000 households affected. The material damage is also considerable: almost 37,500 houses were affected, including 893 destroyed, 3,000 head of cattle were lost and 30,000 hectares of cultivated land across the country flooded. The MSPP has also noted an upsurge in suspected cases of cholera.  (OCHA, 17 Jul 2023)",https://reliefweb.int/disaster/fl-2023-000085-hti
Dominican Republic: Floods ,Jun,2023,Past Disaster,Flood1 more,Dominican Rep.,"Between 2 and 4 June 2023, the Dominican Republic experienced numerous incidents of urban and rural flooding, river overflowing, and landslides. The affected areas spanned several provinces, including Azua, Barahona, Bahoruco, Dajabón, Elías Piña, Espaillat, Independencia, La Vega, Pedernales, Santiago, and Santiago Rodríguez.In Valverde, partial damage to approximately 835 homes have been reported. Flooding of the La Ciénega river caused landslides that cut off communication roads between several communities as well as damage to 150 homes and collapse of the electricity system in San José de Ocóa. In the municipality of Jimani, a total of 183 houses were reported to have suffered damage; approximately 329 hectares of crops were completely destroyed. The province of Azua, especially in the municipality of Padre las Casas, reported that the overflowing of rivers and ravines left approximately 20,000 people without water services. According to a public health report from 7 June, an increase in diarrheic diseases and confirmed cases of cholera have been reported. (IFRC, 19 Jun 2023)On 24 August, Tropical Storm Franklin passed north over the Dominican Republic. [...] Franklin affected 680 homes (3 completely destroyed), left 24 communities isolated and forced some 3,390 people to evacuate, with approximately 89 people still sheltered across 9 evacuation centres, mostly in the San Cristóbal, Pedernales and Barahona provinces. Some 32 provinces remain under a yellow alert. As of 25 August, PAHO/WHO and media sources report that there has been one death, two missing people and two people injured. (OCHA, 28 Aug 2023)",https://reliefweb.int/disaster/fl-2023-000103-dom
Pakistan: Floods ,Jun,2023,Past Disaster,Flash Flood2 more,Pakistan,"On 10 June, heavy rains and rain-related incidents resulted in the loss of at least 33 lives and injuries to around 150 people inKhyber Pakhtunkhwa (KP)andPunjabprovinces. The damages include partial destruction of three schools, complete collapse of two houses, and partial damages to over 160 houses. In Chan village of the Khushab district in Punjab, three girls lost their lives when their house wall collapsed due to the intensity of the rain. Furthermore, 10 people were injured in rain-related incidents in Gujranwala. The torrential downpours and dusty winds resulted in power outages in various areas of both KP and Punjab. (OCHA, 15 Jun 2023)Severe weather-related incidents due to pre-monsoon rainfall continues to affect central and northern Pakistan, causing severe weather-related incidents that resulted in an increasing number of casualties and more damage and affecting mostly the Provinces ofPunjab, Khyber Pakhtunkhwa, BalochistanandAzad Jammu and Kashmir. According to the National Disaster Management Authority (NDMA), as of 6 July, the number of deaths increased to 50: 34 in Punjab, 10 in Khyber Pakhtunkhwa, five in Balochistan and one in Azad Jammu and Kashmir. (ECHO, 7 Jul 2023)The National Disaster Management Authority (NDMA) reports, as of 18 July, 99 fatalities, 175 injured people and 130 damaged houses across the country since 25 June. Media also report, as of 19 July, 11 more fatalities inIslamabad, due to a house collapsing caused by the heavy rainfall. (ECHO, 20 Jul 2023)According to the PDMA, heavy rains and flash floods between 17 July and 23 July resulted in the deaths of 11 individuals and ten people sustained injuries across multiple districts ofKhyber Pakhtunkhwaincluding Khyber, Swat, Batagram, Mansehra, Karak, Mardan, Shangla, Upper Kohistan, Upper Dir, Lower Dir, Buner, Malakand, Bajour, Abbottabad, Upper Chitral, and Lower Chitral. Heavy rains also caused damage to two schools and 109 houses, including 17 completely destroyed and 92 partially damaged. [...] InSindhprovince, six union councils of Dadu district are affected by the flood waters with an estimated 183 villages and 102,268 people affected as the main roads are underwater. InBalochistanprovince, 6 people died, 11 were injured, and 15 houses and 10 shops/boundary walls were damaged in rain-related incidents in Awaran, Zhob, Killa Saifullah and Nasirabad districts. InPunjabprovince, 10 people died and 13 others were injured in rain-related incidents (roof collapse, drowning) in the districts of Lahore, Gujranwala, Okara, Rawalpindi, Faisalabad, and Bahawalpur. (OCHA, 24 Jul 2023)The death toll from rain and flood related incidents reached 179, with over 264 people injured, mostly inPunjab(67) andKhyber Pakhtunkhwa(51). Similarly, 1,594 houses were damaged, mostly in Balochistan (445). InSindh, 183 villages of district Dadu were affected as access roads are flooded; 70 villages of Pir Jo Goth and Gambat were severed after the Indus river inundated Katcha area of Khairpur district; 324 houses were damaged in Jacobabad and Sukkur districts. InBalochistan, the government has declared Jafferabad, Sohbatpur, Kharan, Jhal Magsi, Punjgoor, and Washuk districts as calamity hit and requested humanitarian assistance. In Washuk and Kharan districts, 2,800 houses were damaged due to flash floods after the Panjgur-Newan dam has been broken by recent monsoon. InGilgit-Baltistanregion, flash floods and mudslides blocked Karakoram Highway; 80 houses have been damaged and 250 km of roads have been affected. (ECHO, 31 Jul 2023)Since the start of the monsoon season, a total of 196 people died, more than 200 were injured with thousands of houses damaged across the country, particularly inBalochistanwhere 3,838 houses were damaged. A total of 29,282 individuals are displaced in flood affected districts so far. Major needs assessed by partners include food, clean drinking water and safe shelters. More specifically, inAzad Jammu & Kashmirregion, so far 16 people died, and 444 houses damaged. InChitral, since mid-July, 672 houses were fully and partially damaged, in addition to 230 irrigation channels, 217 water supply schemes, 68 bridges, 38km of roads, 13 micro hydel powerhouses, 87 shops, 19 vehicles, 37 mills, and 119 cattle sheds. Emergency has been declared until 15 August. (ECHO, 7 Aug 2023)According to media, as of 27 August, 16 people died, 36 have been injured and more than 150,000 people have been evacuated in centralPunjabProvince in eastern Pakistan where several hundred villages have been inundated due to floods of the Sutlej River. (ECHO, 28 Aug 2023) The National Disaster Management Authority (NDMA) reported the evacuation of more than 378,000 people and over 20,000 animals to secure locations. (OCHA, 28 Aug 2023)Since 17 August, weeks of heavy monsoon rain flooded Sutlej River in Pakistan. The high flood destroyed levees and villages at several places, displacing more than 162,257 people and submerging 153,231 acres of land with standing crops. According to media, the Provincial Disaster Management Authority (PDMA) ofPunjabhas set up 178 relief camps and 95 medical camps in the affected districts. The water level in Sutlej River has reached ""extremely high level"" in Bahawalnagar that entered in 90 villages along the riverbank. (ECHO, 31 Aug 2023)Heavy rainfall has again affected Pakistan since 1 September. Since the onset of monsoon, 394,314 individuals have been displaced in flood affected areas, mostly in Punjab (323,612).Punjab, Sindh,andBalochistansuffered the most damages to houses and shelters. Partners reported 79,489 confirmed malaria positive cases as of 1 September 2023. (ECHO, 4 Sep 2023)The number of casualties and evacuated people is still increasing due to the monsoon rainfall that has been affecting several provinces of Pakistan causing severe floods and a number of severe weather-related incidents. Over the last 24 hours, the National Disaster Management Authority (NDMA) reports two fatalities across theKhyber Pakhtunkhwa (KP)Province and seven injured people: three in KP and four more inPunjabProvince. In addition, four damaged houses were reported across both provinces.Since 25 June, NDMA reported 226 fatalities, 349 injured people, more than 547,400 evacuated and rescued people and nearly 5,800 damaged houses across the country.NDMA assisted the population also with 349 relief camps and 249 medical camps. As of 25 September, the EU released an additional EUR 1 million to address most pressing needs of vulnerable people in the Provinces of Balochistan, Sindh, Punjab and Khyber Pakhtunkhwa. The allocation will provide multi-sectoral humanitarian assistance (multi-purpose cash assistance, shelters and non-food items). (ECHO, 28 Sep 2023)",https://reliefweb.int/disaster/fl-2023-000119-pak
Argentina: Floods ,Jun,2023,Past Disaster,Flash Flood1 more,Argentina,"On 29 May, the Undersecretary of Emergencies and Civil Protection of the Municipality of Quilmes formally requested support from the Argentine Red Cross to assist families affected by flash floods in the municipality of Quilmes, province of Buenos Aires, Argentina.As of 1 June, the municipal government reported that approximately 4,000 families (20,000 people) have been affected (out of a total of 221,850 households in the municipality), mostly in the neighborhoods located along the banks of the Piedras, Santo Domingo and San Francisco streams. Rainfall exceeded 130 millimeters in some municipalities, causing streets to flood and streams to overflow. (IFRC, 7 Jun 2023)On 28 June, the Argentine Red Cross received a new formal request from the government to support families affected
by recent flooding in the Province of Neuquén, situated approximately 1,000 km away from the Province of Buenos
Aires. As of 5 July, over 20 localities have experienced the impact of the hydro-meteorological event, compounded by
pre-existing vulnerabilities stemming from their geographical location. The northern part of the province has
witnessed a return to normal river conditions. However, in the central and southern regions, water flows remain
high and continue to rise, leading to ongoing emergency situations. (IFRC, 18 Jul 2023)",https://reliefweb.int/disaster/fl-2023-000089-arg
Italy: Floods ,May,2023,Past Disaster,Flood1 more,Italy,"In a span of 6 days, from 01 May 2023 to 17 May 2023, there were two consecutive events in Emilia-Romagna that resulted in a total of 80 hours of rainfall. After the first event, managed at the regional and local levels, applying the contingency plans previously defined, and closed a second, out-of-scale event, happened. There have been 379 landslides in 57 municipalities, with 672 road closures, including 414 complete closures, leaving parts of the rural area isolated. There are 23,000 evacuees distributed among Ravenna, Forlì, Bologna, and Rimini. In Conselice, due to the particular geographical situation, the community has been hit three times. Strong intervention is also needed in Faenza, where water has reached the second floor of some houses.. (IFRC, 2 June 2023)",https://reliefweb.int/disaster/fl-2023-000088-ita
Bosnia and Herzegovina: Floods ,May,2023,Past Disaster,Flood1 more,Bosnia and Herzegovina,"The northwestern area of Bosnia and Herzegovina experienced extensive and intense rainfall, leading to swelling of the Una and Sana rivers, along with their tributaries, and causing widespread flooding in the region. The rainfall on 14 - 15 May exceeded forecasts and triggered a flood wave. [...] The situation further worsened on the night of 15 - 16 May, with an additional rainfall of about 40mm, spreading the flood wave across the wider area. The rising water levels of the Una and Sana rivers, along with their tributaries, caused flooding that had already impacted the population of the northwestern part of Bosnia and Herzegovina on 15 May. [...] The flood, which impacted the territories of 12 municipalities in the northwestern region of Bosnia and Herzegovina, directly affected 887 households. These households experienced substantial damage to residential properties and essential infrastructure required for daily activities and the livelihoods of the local population. Moreover, numerous crops and agricultural land, which serve as a primary source of income for a significant portion of the affected population, were destroyed. [...] Over 40 residents were placed in life-threatening situations, and more than 10 households had to be displaced. Additionally, hundreds of homes were subjected to significant levels of humidity during the water surge, posing a health risk to the population in the coming period. (IFRC, 31 May 2023)",https://reliefweb.int/disaster/fl-2023-000079-bih
