disaster,month,year,status,disaster_type,affected_country,description,reference
Southern Africa: Floods ,Jan,2017,Past Disaster,Flash Flood2 more,Mozambique6 more,"Since the beginning of January 2017, heavy seasonal rainfall has been affecting Southern Africa.InMozambique,44 people have died and 79,000 have been affected mainly in the central and southern provinces in January. The Mozambican authorities issued an orange alert for the provinces of Maputo, Gaza, Inhambane and Nampula, yet areas of Tete and Sofala provinces have also been affected. The orange alert means that government institutions are planning for an impending disaster. Continued rainfall has been forecast for the first quarter of 2017. Rains are expected to continue, which will increase the number of people affected. The risk of vector- and water-borne diseases is particularly high, as both cholera and malaria are endemic and outbreaks recurring. (ACAPS, 26 Jan 2017)InMalawi, due to La Niña weather phenomenon since the onset of the rainy season, many districts have received normal to above normal rainfall triggering flash floods in some of the districts. Between 4 and 10 February, heavy rain caused the worst flooding in Salima District in four Traditional Authorities of Ndindi, Pemba, Kambwiri and Maganga. A total of 35,304 people have been affected. 7,216 people have been displaced and are homeless and are dwelling in school blocks. (Act Alliance, 15 Feb 2017)On 15 February,Tropical Cyclone Dineomade landfall near Inhambane, SouthernMozambique. Shortly after, the storm evolved from severe tropical storm to Category III Tropical Cyclone and was reclassified as Ex-Dineo. The initial report indicated 3 deaths and 4 injured, damaged Infrastructure (electricity, and roads) as a result of the storm in the affected areas. The National Institute for Disaster Management (INGC) projects that urban flooding in small villages and cities may affect 200,000 people over the next 7 days and the following river basins would be at risk of flooding. (IFRC, 18 Feb 2017)Between January and March 2017,Zimbabweexperienced severe flooding across 37 districts of the country, which damaged local infrastructure, livelihoods, transportation routes, and homes.  (IFRC, 30 May 2017)Between 18 and 23 February 2017,Botswanawas hit by the tropical depression, ex-Dineo which caused significant flooding across the country. As a result of inundations, bridges have collapsed, roads have been closed, and health facilities have been flooded. The Government has closed schools in some districts to reduce the risk of children drowning, however in some districts children must still travel long distances to school in sometimes hazardous flood conditions. (IFRC, 11 Mar 2017)InNamibiasome 23,581 learners from schools in Omusati Region are currently idling at home as a precautionary measure taken by 67 schools that have been flooded by the incessant heavy rains that have deluged the north of Namibia in recent weeks. Apart from Omusati Region, schools in Ohangwena are also flooded with rainwater gushing into a number of classrooms. (New Era, 10 Mar 2017)Heavy rain has been affectingAngolaover the past days, especially the north-western provinces, causing floods. Local media reported, as of 24 March at 7.00 UTC, 11 deaths in the province of Luanda, several missing people, 700 houses destroyed and at least 5 300 houses flooded. (ECHO, 24 Mar 2017)",https://reliefweb.int/disaster/fl-2017-000012-moz
Thailand: Floods ,Dec,2016,Past Disaster,Flood,Thailand,"Continuous heavy rains caused widespread flooding across 11 provinces in southern Thailand. As of 9 January, over 330,300 households were affected and authorities reported 21 deaths. The Government upgraded the disaster management response level to 3 (large scale disaster) and established disaster command centres in Surat Thani and Songkla to coordinate the national response. With rains forecast to continue until 10 January, a public warning on potential landslides was issued. The UN Resident Coordinator has issued a letter to the Department of Disaster Prevention and Mitigation (DDPM) offering support. (OCHA, 9 Jan 2017)The flood death toll in the South reached 91 on 28 January 2017. Four people remain missing, according to the Department of Disaster Prevention and Mitigation (DDPM). The deaths and missing persons were reported across 12 provinces, said Chatchai Promlert, DDPM director-general. These areas have been plagued by flooding since 1 December. About 1.8 million people and 590,000 families have suffered from the floods' effects. The floods have also damaged 4,314 roads, 348 bridges, 270 drains, 126 weirs, two reservoirs, 70 government offices and 2,336 schools, said Mr Chatchai. (Bangkok Post, 29 Jan 2017)By 3 February, Thailand's Department of Disaster Prevention and Mitigation had reported that three provinces were still dealing with flooding. More than 3,400 households were affected. (Govt. Thailand, 03 Feb 2017)On 14 February, Thai authorities downgraded the disaster management response level for the floods from Level 3 to Level 2, or from a large-scale disaster to a medium-scale disaster. (Govt. of Thailand, 14 Feb 2017)",https://reliefweb.int/disaster/fl-2017-000004-tha
Malaysia: Floods ,Dec,2016,Past Disaster,Flood,Malaysia,"Seasonal heavy continuous rains in Malaysia from 26 December 2016 caused flooding in two states: Kelantan and Terengganu. The floods temporarily displaced about 25,000 people and have rendered some villages inaccessible due to damaged bridges and blocked roads.(IFRC, 5 Jan 2017)Rains after 23 January 2017 caused flooding in six states: Johor, Kelantan, Pahang, Perak, Selangor and Sabah. The worst-hit states wereJohor and Pahang, where waters rose 1.5 metres in certain areas. The total number of affected people was 14,903 as of 27 January.(IFRC, 27 Jan 2017)The situation improved significantly after the Lunar New Year weekend (28-29 January), with floodwater receding in several affected districts, allowing families that were in relief centres to return home. According to media reports, at least 80 per cent of evacuees in the affected areas have returned home. As of 8 February, 189 people (54 families) were still in active relief centres in Perak.While the situation has improved, forecasts by the Malaysian Meteorological Department projected that more rains may affect Peninsular Malaysia in the second week of February. Such as scenario would affect the condition of major rivers in Pahang, Terengganu, Johor and Perak, which are still at critical levels. The public authorities, in particular NADMA, and response organizations, including the Malaysian Red Crescent Society (MRCS), have taken precautionary efforts to ensure that response teams are ready for the potential second cycle of flooding in these areas.(IFRC, 9 Feb 2017)During the week of 20 - 26 February, torrential rains caused the Baram and Limbang rivers in Sarawak to overflow. This triggered flooding that forced the evacuation of 830 people.(ASEAN, 26 Feb 2017)Torrential rain has caused flooding in Pahang. Responding to the situation, the local authority evacuated 233 people to the evacuation centres.(ASEAN, 5 Mar 2017)Floods have affected people in Hulu Perak and Kerian Districs, Perak State. 232 people were evacuated due to the incident.(ASEAN, 2 Apr 2017)",https://reliefweb.int/disaster/fl-2017-000002-mys
Typhoon Nock-ten ,Dec,2016,Past Disaster,Flash Flood3 more,Philippines,"A Tropical Cyclone named NOCK-TEN formed over the north-western Pacific Ocean, near the Federated States of Micronesia, on 21 December. It then started moving north-west and it passed close to Yap island on 22 Dec morning (UTC), as a Tropical Storm. (ECHO, 22 Dec 2016)Typhoon Nock-Ten entered the Philippine Area of Responsibility (PAR) on 23 December. It intensified into a typhoon on 24 December and made landfall over Catanduanes province on the evening of 25 December, then crossed Albay, Camarines Sur, Southern Quezon, Laguna, Batangas and Cavite. (OCHA, 26 Dec 2016)Initially, local disaster management officials were pressed to convince citizens to abandon Christmas celebrations and head to evacuation shelters. More than 400,000 people heeded the call and were evacuated across 18 provinces after local officials imposed forced evacuations and offered enticements, such as free Christmas dinners, at evacuation sites. (OCHA, 02 Feb 2017)As of 27 December, Typhoon Nock-ten left the landmass moved out to the West Philippine Sea after making eight landfalls. Metro Manila, which had been forecasted to be struck with storm-force winds and moderate to heavy rainfall, was mostly spared as the typhoon weakened and the track moved slightly south. Only isolated low floods in some areas were reported in the capital. The main focus of the impact shifted closer to where the typhoon first made landfall in the provinces of Catanduanes, Albay and Camarines Sur, which were affected by strong winds, heavy rains and storm surge. (IFRC, 27 Dec 2016)On 29 December, the International Federation of Red Cross and Red Crescent Societies launched a 1.6-million Swiss Franc emergency appeal (USD 1.56 million, Euro 1.5 million) to help the Philippine Red Cross assist more than 20,000 people with emergency relief assistance and longer term recovery support. As of 29 December, there had been 10 confirmed deaths. (IFRC, 29 Dec 2016)As of 18 January, only 7 percent of the IFRC's original 1.6-million Swiss Franc emergency appeal had materialized through hard pledges. With the appeal ""significantly underfunded"", PRC and IFRC called on partners to provide much-needed support to enable the delivery of assistance to affected populations. Initial assessments by PRC indicated that immediate needs for food, non-food items, safe drinking water and emergency shelter materials were essential to provide relief to affected households during the emergency phase. Shelter, livelihoods and risk reduction are top priorities for recovery. (IFRC, 18 Jan 2017)As of 24 January, there were 368 people still displaced as a result of Typhoon Nock-ten, according to  the Department of Social Welfare and Development. (OCHA, 02 Feb 2017)As of 31 January, the storm had affected 2.88 million people in Regions IV-A, IV-B, V and VIII. Roughly 393,400 buildings had been damaged, while 194,900 metric tons of rice, corn and high value crops totalling USD 90 million were recorded as agricultural production losses. (OCHA, 31 Jan 2017)",https://reliefweb.int/disaster/tc-2016-000134-phl
Tropical Depression TD04F ,Dec,2016,Past Disaster,Flood2 more,Fiji,"Due to a Tropical Depression that is passing near the Fiji islands, heavy rain and strong winds have been affecting most areas of the country, especially the Central and Eastern divisions, causing floods and landslides. Approx. 226 mm of rain in 24 h were recorded in Nausori (Central division, Viti Levu island) over 15-16 December.Local media, as of 16 December early morning (UTC), reported that 282 people have been evacuated, of which 120 in the Eastern and 162 in the Central divisions. Traffic has been disrupted and power cut off in several parts of these divisions.Over the next 48 hours, the Tropical Depression will continue to move near the eastern side of Fiji islands. Heavy rain and strong winds may continue to affect most of the country. As of 16 December early morning (UTC), Heavy Rain and Flood Warnings are in effect for the whole country. (ECHO, 16 Dec 2016)The Tropical Depression was located to the west of Fiji as of 19 December. Some 1,363 people have been evacuated to 86 evacuation centres following flash floods. In Central Division, area water supplies have been cut off and power outages have been reported. In the Northern Division, the government is providing emergency food rations to Qamea Island. (OCHA, 19 Dec 2016)As of 22 December, the flood alert in Fiji had been cancelled, but there was extensive damage reported in parts of the country, according to media reports. Around 50,000 people are facing water disruptions in the Central Division as a result of damage to the water pumping stations at Fiji's Waimanu and Wainibukur. A total of 2,327 people are currently being housed at 119 evacuation centres around the country. Officials with the Disaster Management Office, or DISMAC, said the initial assessment damage from the tropical depression stands at $FJD10.7 million, or over $US 5.3 million. (RNZ, 22 Dec 2016)As of 23 December, the Red Cross has reached ten communities. Distribution of cleaning kits to flood-affected households has commenced along with other non-food assistance. Restoring access to fresh water to Rakiraki for drinking and cleaning remains the priority. (RNZ, 23 Dec 2016)",https://reliefweb.int/disaster/tc-2016-000132-fji
South America: Floods and Landslides ,Dec,2016,Past Disaster,Flood1 more,Argentina10 more,"ColombiaStrong rains caused flooding and landslides in Cali. According to a preliminary report of the emergency, 6 deaths due to a landslide in the neighborhood of the Siloe were reported on 1 December. (PAHO/WHO, 2 Dec 2016)As a result of the early January rains, about 11,125 people are affected by flooded rivers in the municipalities of Tumaco, Barbacoas, Roberto Payán and Magüi Payán in Nariño. (OCHA, 10 Jan 2017)As of 7 February, 333 people, consisting approximately of 77 families and 33 students,  have been affected by heavy floods and 8 flooded rivers in Nariño, a situation which affected 8 of the department's municipalities. Reports show a total of 65 damaged houses as well as 5 that were destroyed. (OCHA, 7 Feb 2017)On the night of 31 March 2017, increased rainfall caused the Mocoa, Sangoyaco and Mulata Rivers to overflow, which in turn generated amudslide in the municipality of Mocoa, capital of the department of Putumayo...[T]he Colombian government decided to declare an economic and social emergency. (IFRC, 7 Apr 2017)SeeColombia: Mudslides - Mar 2017for the updates on this disaster.As of 29 June, OCHA reported that the intense rains of recent days triggered sudden surges, overflowing rivers, and increased levels of the Sinú and San Jorge rivers, affecting approximately 25,000 people in different municipalities of the department. Due to the continuation and persistence of the rains, the number of people affected is expected to increase. The municipality of San Bernardo del Viento has been one of the most affected with a total of 2,187 families/10,935 people affected in rural and urban areas, also reporting the loss of 189 hectares of bread crops.  (OCHA, 29 Jun 2017)As of mid-July, continuous rains have increased the levels of the rivers Sinú and San Jorge in Córdoba, generating new affectations in approximately 15,000 people, in six municipalities of the department. This situation increased to 43,000 the total number of people with needs since the end of June. The total number of people affected could increase, as the red alert of IDEAM persists for these rivers. More than 14,000 people (2,818 families) and about 1,081 agricultural hectares have been reported as affected. There is also damage in 31 educational establishments causing access limitations to at least 2,873 students.  (OCHA, 18 Jul 2017)ArgentinaA storm surge on 26 December caused flooding and heavy damage in the provinces of Buenos Aires and Rosario. As of January 2017, more than 10 towns in Santa Fe were still flooded. (La Nación, 4 Jan 2017)As of 17 January, approximately 800 people suffered total property losses in Arroyo Seco, one of the towns hardest hit by the storm over the weekend in the province of Santa Fe. The sports community center Los Tiburones is housing around 234 evacuees. (PAHO, 17 Jan 2017)The worsening of already unstable meteorological conditions caused a significant increase in rainfall in the first weeks of April of this year, affecting 15 provinces and 33,482 people across the country and causing considerable losses and damages. This increase gradually began the last week of March.
On 30 March, the governor of the province of Chubut declared a 120-day weather emergency because of the impact suffered in the last week of March. However, a new storm packing 45- to 50-kph winds hit Comodoro Rivadavia on 7 April, dumping almost 100 millimetres of rain over a period of 24 hours, killing two people and directly and indirectly affecting 100,000 others. Twelve additional collective centres had to be opened - for a total of 24 - which are primarily managed by neighbourhood point persons. According to official province government estimates, some 3000 people had to be evacuated, in addition to the more than 5000 others across the province who were forced to self-evacuate.To 8 April, a total of 3000 people have been evacuated because of this week's events, which has caused variations in the number of people housed in the collective centres mentioned above. (IFRC, 19 Apr 2017)On 26 April, the Gov't of Argentina declared water emergency as per the recent meteorological conditions for 180 days for the provinces Catamarca, Corrientes, Buenos Aires, Santa Fe, Misiones, Chubut, Tucumán, Río Negro, La Pampa, Salta and Jujuy. (Gov't of Argentina, 26 Apr 2017)As of 12 June, more than 2,800 people had to be evacuated from Entre Rios Province due to the flooded Uruguay river. (Gov't of Argentina, 12 Jun 2017)PeruSeePeru: Floods and Landslides - Feb 2017Uruguay159 people remain displaced throughout Uruguay due to recent weather events. Of this total 70 were officially evacuated and were 89 self-evacuated. The affected departments are Cerro Largo, Tacuarembó y Treinta and Tres. The National Emergency System through the Departmental Emergency Committees (CDE) of Cerro Largo, Tacuarembó and Treinta y Tres are coordinating response actions in the respective departments.  (Gov't of Uruguay, 14 Aug 2017)ParaguayHeavy rains and landslides in the San Pedro district affected some 130 families. Government authorities delivered food and NFIs. (Gov’t of Paraguay, 19 Dec 2016)BrazilThe northern state of Amazonas, Eirunepé and Itamarati by the Juruá river declared the state of emergency due to the floods on 9 March. They are now set to receive humanitarian help from the federal and state governments. At least 3,200 families were affected.(Gov't of Brazil, 9 Mar 2017)In the north-eastern region of Brazil, record levels of accumulated rainfall were registered between 21 and 27 May. This heavy precipitation has produced landslides, flooding and damage to public infrastructure and homes in Alagoas and Pernambuco.(IFRC, 14 Jun 2017)BoliviaThe Government declared a state of emergency on 30 December for the mining region of Centro Caracoles, as floods affected Villa Carmen, Pongo and parts of Quime. (Gov’t of Bolivia, 30 Dec 2016) On 7 January, all of Quime was declared in state of emergency and 70 families were without basic services. (RedHum, 5 Jan 2017)ChileAs of late February, landslides around the capital of Santiago contaminated a major river and cut off the drinking water supply to around 4 million people. Officials have said that at least 3 people have died in the floods. (Deutsche Welle, 27 Feb 2017)GuyanaThe lives of over 3,000 hinterland residents have been significantly affected as a result of the massive flooding which struck several lowland communities in Region Seven (Cuyuni-Mazaruni) and Region Eight (Potaro-Siparuni). The damage has been severe to the extent where the school in Itabac was washed away and has since been rendered unstable. Some 3,274 persons have been affected in Region 8. However, the full impact of the flood in Region 7 is still being assessed. (Redhum, 24 May 2017)SurinameAfter heavy rains in late February, the  communities of South (Tepu, Kwama) – Upper Marowijne; Boven Suriname-around Brokopondo Lake (Atjoni), Lawa Tapanahony have been affected. Approximately 6,000-8,000 people are displaced and/or vulnerable, including migrants. The flood waters may have affected water supply and other public infrastructure, which has caused community members from Marowijne to seek shelter in French Guyana. (PAHO, 27 Feb 2017)EcuadorPortoviejo authorities declared a state of emergency on 10 February due to the rains which have affected at least 78 areas of the canton. The most affected are: Picoazá, San Pablo, San Alejo, Fátima. It was indicated that this declaration implies the mobilization of resources and personnel to attend the affected areas in Portoviejo. (PAHO, 10 Feb 2017)",https://reliefweb.int/disaster/fl-2016-000137-arg
Saint Vincent and the Grenadines: Floods ,Nov,2016,Past Disaster,Flood,St. Vincent & Grenadines,"On Tuesday, 29 November 2016, St. Vincent and the Grenadines was impacted by heavy rains, which resulted in flooding and landslides in several communities. Sandy Bay in the north-eastern area of St. Vincent was the most severely affected community; however, the villages of Magum, Orange Hill, Overland, London, Point, Owia and Fancy in the north-east and Spring Village, Coulls Hill, Troumaca, Rose Bank, Sharpes, Fitz Hughes and Chateaubelair in the northwest of St. Vincent were also impacted. Some people suffered losses to their subsistence crops and livestock, and a they are experiencing severe psychosocial effects, access to water and sanitation issues, and financial challenges as a direct consequence of the flooding. (IFRC, 14 Dec 2016)The flooding destroyed 15 houses, severely damaged 20 houses and partially damaged more than 50. (IFRC, 19 Dec 2016)The DREF operation aims to provide emergency humanitarian aid to at least 400 families (2,000 affected people) in order to respond to and meet basic needs in health, water and sanitation and shelter and settlements (non-food items) during the three-month operation, which will end on 13 March 2017. (IFRC, 1 Feb 2017)",https://reliefweb.int/disaster/fl-2016-000130-vct
