disaster,month,year,status,disaster_type,affected_country,description,reference
India: Floods and Landslides ,May,2017,Past Disaster,Flood1 more,India,"According to local media, as of 7 May at 7.00 UTC, six people died, of which two by floods in Phek district (Nagaland State) and four more in Giridih district (Jharkhand State) due to lightening strikes. According to Assam State Disaster Management Authority, as of 7 June at 7.00 UTC, over 100 000 people are affected by floods in Assam. (ECHO, 7 Jun 2017)Severe weather, including thunderstorms, heavy rain and strong winds, continues to affect the Indian states of Arunachal Pradesh, Assam, Manipur, Mizoram and Nagaland, causing floods. According to local media, as of 16 June at 7.00 UTC, at least 14 people died in Assam and Mizoram States. Assam National authorities mentioned that over 18 000 people were affected in four districts. (ECHO, 16 Jun 2017)Flooding worsened in Assam on 2 July, when new areas were submerged by the rising waters of the Brahmaputra River and its tributaries. As of 5 July, official figures show over 390,000 people have been affected in over 850 villages across 15 out of 32 districts. At least one person has died. Just under 45,000 people are reported to be sheltering in 160 temporary relief centres. 31,000 more than on 2 July. More than 16,000 hectares of agricultural land have been flooded Heavy rainfall has occurred across much of India since June, as is typical during the June–September monsoon. Rainfall across the state, however, is still at normal regional levels for the season. Heavier rain is expected in the coming days and weeks. (ACAPS, 6 Jul 2017)Since early July, heavy rains and floods were reported across India (Assam, Manipur, Arunachal Pradesh, Gujarat, Bihar, Uttarkand, Uttar Pradesh and Orissa states). In Assam State alone, state disaster management authorities reported that over 1.7 million people have been affected as of 12 July. Media sources reported that at least 150 people have died nationwide due to the floods. About 1,300 National Disaster Response Force personnel have been deployed for the relief operations along with the Indian Armed Forces. The response continues to be led by national authorities. International assistance has not been requested. (OCHA, 17 Jul 2017)Since 19 July, two major floods affected 29 districts in Assam causing severe damage to houses and agricultural land. Over 165,000 people have been affected, with 76 deaths reported. In Gujarat, 94 people have reportedly been killed. As of 28 July, Gujarat State authorities are providing assistance to 18,000 people inside relief camps, while 58 relief camps in Assam are serving 11,600 people. The Indian Armed Forces and civil society organizations are supporting the Government-led response. No international assistance has been requested. (OCHA, 31 Jul 2017)Since 15 July, the state of Odisha has witnessed heavy rainfall, triggering flash floods in the rivers Nagabali and Kalyani of Rayagada district. More than 28,000 people in 50 villages under Rayagada Block and 20 villages under Kalyansinghpur Block have been affected. (ACT Alliance, 8 Aug 2017)Flooding in Assam and neighbouring north-eastern states has affected over one million people. As of 20 August, at least 303 people in Assam, Bihar and West Bengal have died. In Assam, 304 relief camps have been set up where 138,648 people have taken shelter. In Bihar, 1,289 relief camps are operational in 17 districts. With access restricted, rescue operations are ongoing using helicopters. The Prime Minister announced INR 20 billion for relief, rehabilitation, reconstruction and flood mitigation. (OCHA, 21 Aug 2017)As of 24 August, 32.1 million people have been affected by flooding across Assam, Bihar, Uttar Pradesh, and West Bengal. More than 600 people are known to have died. Those affected by the floods have been evacuated to safer places by the army, police and navy with boats and helicopters. Almost 2,000 relief camps have been established where authorities are providing food and shelter. (OCHA, 28 Aug 2017)In Manipur, many low-lying areas in and around Imphal, the capital of Manipur, were inundated by flood waters. The road network was cut off at many places due to landslides. Flood waters still remain at many low-lying areas, increasing vulnerability for water borne diseases. Four districts – Imphal West, Imphal East, Thoubal and Bishnupur were the most affected districts. As per the estimates reported by Manipur State Department of Relief and Disaster Management, approximately 3,000 families, 27,000 livestock were affected. (IFRC, 9 Oct 2017)As of 17 October, Bangalore has recorded around 1615mm of rainfall this year, crossing the previous record of 1606mm in 2005. The rain has claimed the lives more than 10 residents. Besides Bangalore, rains continue to lash several other districts in Karnataka. Mysore, Gulbarga, Gadag and Kolar also witnessed heavy rainfall in the last two days. The government has announced that the southwest monsoon is intensifying with no signs of relief in the days to come. (Govt. India, 17 Oct 2017)",https://reliefweb.int/disaster/fl-2017-000064-ind
Haiti: Floods ,Apr,2017,Past Disaster,Flash Flood2 more,Haiti,"From 20 to 24 April 2017, heavy rainfall caused floods and landslides in the departments of the South, South East, Grand'Anse and Nippes. The South department is the most affected. Initial estimates indicate 4 deaths, 15 homes destroyed, and nearly 10,000 homes that could have been damaged in the South Department. According to the Delegate of the Department of the South, 80% of the spring harvest could have been destroyed.  Six communes - Chantal, Les Anglais, Chardonnieres, Les Coteaux, Port-à-Piment and Tiburon - have been inaccessible since April 23 due to the severe erosion of the road linking Port Salut and the west coast, hindering access. The humanitarian community has deployed teams to conduct a first multi-sectorial needs assessment in the 12 most affected municipalities.The Departmental Delegation of the South estimates that 350,000 people have been affected. In addition, IOM states that the 197 families displaced byHurricane Matthewin Cavaillon are also affected by the floods situation. (OCHA, 25 Apr 2017). Bean crop yields in the region were significantly affected and are likely to be reduced by as much as half in parts of Sud and wider areas of Grand’Anse department due to the localized flooding. (FEWS, May 2017)Les dégâts causés par les pluies qui se sont abattues sur les départements du Sud, du Sud-Est, de la Grand’Anse et des Nippes continuent à être évalués. Le département du Sud reste le plus touché et en particulier les douze communes d’Aquin, Arniquet, Camp Perrin, Cavaillon, Les Anglais, Les Cayes, Les Chardonnières, Maniche, Port-Salut, Roche-à-Bâteau, Saint Louis du Sud, et Torbeck.
La Direction de la Protection Civile (DPC) a annoncé qu’approximativement 15.000 ménages ont été affectés avec un besoin d’assistance humanitaire immédiate. Une partie de ces personnes affectées s’étaient retrouvées en situation de vulnérabilité suite à l’ouragan Matthew. Selon les informations collectées sur le terrain jusqu'à présent, le déplacement de familles vers les centres d'évacuation n'est pas significatif. La plus grande partie des familles retrouvées par les équipes d’OIM dans des centres d'évacuation sont déplacées depuis l'ouragan Matthew et 400 familles ont été recensées jusqu’à présent par les autorités locales et l’OIM. Selon les informations recueillies auprès des autorités locales sur la situation du déplacement, l'école Nationale de Dory à Maniche abrite 100 familles déplacées dont la majorité sont déplacées depuis l'ouragan Matthew. Selon l’OIM, l’Ecole Nationale Mixte de Torbeck abrite 32 familles dont seulement 7 familles de plus que celles qui avaient été déplacées à cause de l’ouragan Matthew. Egalement l’OIM a rapporté que, à Port-Salut, les centres d’évacuation École Aubris de Dupin et École Nationale de Douyon continuent à abriter des déplacés de l’ouragan Matthew (30 et 16 familles respectivement). D'après le prêtre de l’église catholique de Port-Salut, 35 familles sont déplacées suite aux inondations dans la salle paroissiale du Presbytère qui est utilisée comme école depuis l’ouragan Matthew. (OCHA, 1 May 2017)",https://reliefweb.int/disaster/fl-2017-000043-hti
Colombia: Mudslides ,Mar,2017,Past Disaster,Flood1 more,Colombia,"On the night of 31 March 2017, increased rainfall caused the Mocoa, Sangoyaco and Mulata Rivers to overflow, which in turn generated a mudslide in the municipality of Mocoa, capital of the department of Putumayo. UNGRD reported that the affected area received 33 per cent of its monthly total of rainfall (130 mm of the 400-mm monthly average) on the night of the disaster. Per reports, 273 people perished and 262 are injured; injured residents have been treated, and the most serious cases have been transferred to medical centres in Neiva, Popayan and Bogota. There have been 399 Restoration of Family Links (RFL) requests, 25 homes have been destroyed and more than 300 families have been affected. According to the latest official report from the UNGRD-coordinated national crisis room, 17 neighbourhoods were affected (29 blocks), with the greatest devastation seen in the districts of San Fernando, San Miguel, Independencia, Chaparros, San Agustín, Naranjito, Pablo VI, Avenida 17 de Julio, Miraflores and Progreso; the hospital network has collapsed, and 85 per cent of the department was left without electricity, which has since been partially restored. Three aqueducts and the sewage system are affected, 10 roads are damaged, 2 bridges collapsed and 5 are being rehabilitated...Following an extraordinary meeting of the Cabinet at Nariño House, the Colombian government has assessed the catastrophe and the need to provide humanitarian assistance to the affected people and infrastructure investments to rebuild Mocoa and decided to declare an economic and social emergency. (IFRC, 7 Apr 2017)As of early May 2017, the municipality of Mocoa continues clean up and recovery efforts following the devastating mudslide. The water supply has been restored to nearly 70% of the city. 384 people remain in temporarily shelters, and the government continues to provide food, toiletries, and other care; furthermore, the Government announced the allocation of 20,000 million Colombian pesos for an ambitious housing rehabiliation project.  (Government of Colombia, 2 May 2017).On 31 May, ACT Alliance lauchend an appeal of US$ 75,000 for livelihoods restoration. (ACT Alliance, 31 May 2017).",https://reliefweb.int/disaster/ms-2017-000033-col
Tropical Cyclone Enawo ,Mar,2017,Past Disaster,Flood1 more,Madagascar,"On March 8, Enawo weakened from an “intense” to a “moderate” tropical storm...The northeastern Sava region has sustained significant damage to housing and agriculture. Antalaha port is inaccessible and more than half of the city’s homes have been destroyed...Farahalana commune is flooded by Lohoko River, with half of all housing under water....[I]n the Analanjirofo region,...more than 10,000 people are displaced.(Govt/UN HCT, 9 Mar 2017)As at 12 March, the National Office for the Management of Risks and Crises (BNGRC) reported 295,950 people to have been affected by the cyclone, including 84,660 who remain displaced. The number of deaths due to the storm has risen to 50 with 20 people missing and 195 injured. These figures are based on information received to date and may continue to change as more areas previously inaccessible are able to be reached...The initial technical evaluation of the assessment conducted by the BNGRC and participating agencies suggests that humanitarian activities should be prioritized in Maroantsetra, where approximately 40 per cent of the population has been displaced by flooding; in Antalaha, where the cyclone made landfall and where significant damage due to high winds as well as the rain-fed rapid rise in water levels; and in the capital, Antananarivo, where 27,104 people have been displaced by flooding and flood waters have in the past proven to persist longer than in other areas.(Govt/UN HCT, 12 Mar 2017)On 12 March, IFRC launched apreliminary Emergency Appealseeking CHF 892,325 to support the Malagasy Red Cross Society (MRCS) in delivering assistance and support to 25,000 people affected by the Cyclone.(IFRC, 12 Mar 2017)As of 13 March, at least 100,000 people have been directly affected by the cyclone, approximately half of whom are in Antalaha district. At least 50 people have been killed, and 183 wounded, mainly in Analanjirofo and Sava regions. Over 110,000 people have been displaced by flooding and storm waters, particularly in Antalaha and Maroantsetra districts.(ACAPS, 13 Mar 2017)On 23 March, UN and partners appealedfor US$20 million to assist 250,000 people affected by Cyclone Enawo in Madagascar",https://reliefweb.int/disaster/tc-2017-000023-mdg
Peru: Floods and Landslides ,Feb,2017,Past Disaster,Flood1 more,Peru,"A state of emergency was declared for Loreto's provincial municipality of Alto Amazonas on 15 January due to heavy rains and landslides.
On 16 January, the Civil Defense Region Office for Arequipa reported the rain had affected 2,645 people and had damaged 1,122 houses. The Regional Platform of the Civil Defense declared a permanent alert. (PAHO, 17 Jan 2017).As of 6 February, heavy rains, landslides (huaycos) and rivers overflowing have affected more than 70,000 people across Peru. 22 people have died so far, 1 105 houses have been destroyed, 54 schools and 47 health centers have been damaged, and 215 km of roads have been severely affected. The state of emergency has been declared in nine departments. The Department of Lambayeque is the worst affected. Another 47 localities are declared in emergency due to imminent risk. (ECHO, 7 Feb 2017)As of 17 February, a state of emergency was declared for the provinces of Huarochiri, Cañete, Barranca, Yauyos, Huaral, Huaura, Oy, and Canta due to heavy rains. (PAHO, 17 Feb 2017).As of 20 March, some 72,115 people have been affected by the latest floods (639,000 since December 2016). A state of emergency has been declared in 12 regions, while a public health emergency has been declared in 7 regions due to the increasing health risk. (OCHA, 20 Mar 2017)As of 10 May, more than 1.6 million people remain affected and affected in the country as a result of rains and floods. Of these, more than 440,000 are children and adolescents (NNA). Some 31,600 houses at national level have collapsed and 28,000 are reported as uninhabitable, resulting in more than 19,212 people that continue living in temporary shelters. Furthermore, the registered dengue cases have are more than 44,000.Piura, with 26,958 cases is the most affected department, accounting for 60% of the total.(OCHA/UN Country Team in Peru, 26 May 2017)As of 6 June, UNICEF, through implementing partners, has provided humanitarian assistance in WASH, protection, nutrition, health and education to more than 61,000 children and families in the most affected district of Piura(UNICEF, 6 Jun 2017)On 27 June, the UN Country Team in Peru reported that, as of that date, 1,718,331 people were affected and 291,578 severely affected at national level. The departments with the largest number of people affected and severely affected are La Libertad (26.4% of the total), Piura (24.9%), Lambayeque (11%) and Áncash (8%), with approximately 31,339 houses reported collapsed and 25,684 houses are uninhabitable.(OCHA/UN Country Team in Peru, 27 June 2017)In late July, the EU disbursed €1 million in emergency humanitarian aid, deployed civil protection experts and facilitated European donations in kind, including life-saving water pumps from Spain and France to assist those most affected in the northern provinces of Piura, Lambayeque, Tumbes y La Libertad. (ECHO, 19 Jul 2017). In the same period, UNICEF has provided humanitarian assistance in WASH, Protection, Nutrition, Health and Education to 123,560 children and families in the most affected district of Piura (UNICEF, 25 Jul 2017)As of early August, the humanitarian response in Piura reached more than 260,000 people in 35 districts with an amount of 432 finalized activities. (OCHA, 18 Aug 2017)As of 29 August , UNICEF has provided humanitarian assistance in WASH, protection, nutrition, health and education to 179,789 children and their families in the most affected districts of Piura. (UNICEF, 29 Aug 2017)",https://reliefweb.int/disaster/fl-2017-000014
Afghanistan: Avalanches and Floods ,Jan,2017,Past Disaster,Cold Wave2 more,Afghanistan,"On 25 January, heavy snowfall and freezing weather has killed 27 children in a remote district of northern Afghanistan. (RFE, 26 Jan 2017)A large number of avalanche, snowfall and rain-related disasters were reported around Afghanistan between 4-7 February, with 22 out of 34 provinces reported to have been affected. Provinces with casualties and significant damage to homes and livelihoods included Badakhshan (several districts), Balkh (Chimtal), Faryab (Pashtun Kot, Kohistanat), Samangan (Darisuf Bala), Sar-i-Pul (Sozmaqala, Sayad and Balkhab), Hirat (Adraksan), Badghis (Nahya Four and Ab Kamari), Nangarhar (several districts), Paktia (several districts), Khost (several districts), Helmand (Lashkar Gah), Kandahar (Kandahar City), Bamiyan, Daykundi, Parwan and Kapisa (all several districts). (OCHA, 8 Feb 2017)Badakhshan and Nooristan provinces were severely hit by two avalanches, resulting in causalities and destruction of houses followed by flash floods on 18 February that had significantly impacted in Herat, Zabul and Nimroz provinces. An estimated 6,752 families were reportedly affected across Afghanistan, with 194 deaths, and 90 persons sustaining injuries in various parts of the country. The majority of the reported caseloads have been assessed, with a total 2,010 families in need of assistance, while the distribution of relief items is underway and expected to be completed by 02 March 2017. (IOM, 25 Feb 2017)As of 23 February, several homes had been destroyed or swept away by flood waters, and over 20,000 hectares of arable land had been submerged in flood water. An estimated 3,000 people have been affected and displaced by flooding in both Chakhansur and Khashrod districts. Affected populations are in dire need of humanitarian assistance. Some of the affected were already vulnerable prior to the flooding. Many were either internally displaced or returnees from Iran. Access to families affected in Chakhansur district is currently difficult due to high flood waters that have prevented access by road to affected people (ACAPS, 2 Mar 2017)",https://reliefweb.int/disaster/av-2017-000013-afg
Philippines: Floods and Landslides ,Jan,2017,Past Disaster,Flood,Philippines,"As of 20 January, over 63,000 people remain displaced due to flash floods in northern Mindanao and the Visayas from 16 January, with an estimated 48,000 people inside 115 evacuation centres. (OCHA, 23 Jan 2017)According to the National Disaster Risk Reduction and Management Council (NDRRMC), the combined effects of the rains that have lashed starting mid-January resulted in at least nine deaths, injured 10 people, damaged homes and swept away livelihoods, mainly in CARAGA, Davao and Northern Mindanao regions. More than 320,000 households (1.5 million people) have been affected, with at least 1,300 houses damaged. The authorities pre-emptively evacuated over 17,000 households (85,000 people), with 53,200 people still remaining in evacuation centres or staying with host families. Parts of Agusan del Norte, Agusan del Sur, Compostela Valley, Davao Oriental, Lanao del Sur and Maguindanao provinces have been declared under the state of calamity. Initial estimates indicated that the cost of damage caused to agriculture alone is more than PHP 126 million (CHF 2.5 million). (IFRC, 3 Feb 2017)In January 2017, a total of 77,704 families (approximately 387,138 persons) were displaced in Mindanao due to several days of massive flooding caused by heavy and continuous rain. Most of the displaced -- 328,111 persons -- were able to return to their homes as of mid-February. (Protection Cluster, 15 Feb 2017)As of 19 February, over 30,700 people remained displaced in northeastern Mindanao (Caraga region) by flooding triggered by a series of weather systems since 8 January. At least 2,100 people are in 18 shelters, while most are staying with relatives and friends. Local authorities and NGOs, with support from the Department of Social Welfare and Development (DSWD) are providing food and other relief items. (OCHA, 20 Feb 2017)As of 25 February, more than 30,000 people remain displaced by flooding in northeastern Mindanao, with most staying with relatives or friends. Surigao del Norte, which was also affected by the 10 February earthquake, still has 1,150 people displaced by flooding that are staying in evacuation centres. Local disaster management authorities continue to monitor the situation and provide assistance to those displaced. (OCHA, 27 Feb 2017)Flooding in low-lying areas in Mindanao is a yearly occurrence, particularly during monsoon season.  But from January to February this year, the effects of a low pressure area  and the tail-end of a cold front brought unusually heavy rain and flooding in different parts of Mindanao and Visayas.  Over 280,000 people have been affected all over Mindanao.  As of 2 March, over 29,000 people are still displaced in Caraga region. (OCHA, 2 March 2017)As of 12 March, over 11,000 people in Lamitan City (Basilan province) and Tambulig municipality (Zamboanga del Sur province) are displaced by flooding. Two deaths in the provinces of Misamis Occidental and Sarangani and one missing person in Maguindanao province were also reported.
The floods damaged 127 houses, mostly in Lamitan City. Local disaster management authorities, with support from the Autonomous Region in Muslim Mindanao Humanitarian Emergency Action Response Team and the Philippine Red Cross, are providing relief items to those affected in Basilan.  (OCHA, 13 March 2017)",https://reliefweb.int/disaster/fl-2017-000010-phl
Pakistan: Floods and Heavy Snowfalls ,Jan,2017,Past Disaster,Cold Wave3 more,Pakistan,"Continuous heavy rains and record-breaking snow fall have caused widespread flooding across three districts in Balochistan, from 17 to 22 January 2017. The government declared an emergency in the most impacted districts and demanded assistance for roughly 60,000 affected people in the province. On 30 January, the government made an official request to the Pakistan Red Crescent Society, asking for support for 6,000 families. Authorities reported 13 deaths and 650 people injured. (IFRC, 08 Feb 2017)Two separate incidents -- an avalanche and a landslide -- occurred overnight on 17 February in Chitral district, killing eight people and causing additional injuries. (ECHO, 20 Feb 2017)",https://reliefweb.int/disaster/fl-2017-000017-pak
