disaster,month,year,status,disaster_type,affected_country,description,reference
Guatemala: Floods and Landslides ,Jun,2017,Past Disaster,Flood1 more,Guatemala,"The rainy season of 2017 has begun in many regions of the country and to date -CONRED-, has responded to 142 incidents that have directly and indirectly affected 144,415 people nationwide.In 20 departments of the country, actions have been taken to care for those affected - only Santa Rosa and Chimaltenango have reported no major incidents. The departments where incidents have been recorded for the rainy season are Guatemala with 18 incidents; Quiché with 17 incidents; as well as 10 incidents in San Marcos, 10 in Huehuetenango and another 10 in the department of Jutiapa. The incidents which have occurred were floods, landslides and landslides.The rainy season will not end until November, and so far 144,415 people have been affected. There have been 1,470 evacuees, 938 victims, 667 people have been sheltered, and 16 people have reportedly died in the current rainy season 2017. (Gov't of Guatemala, 03 Jul 2017)Between 2-3 September, floods were reported in the departments of Alta Verapaz, Petén and Suchitepéquez, with 2,466 people affected and damage in 438 homes, according to damage assessments and needs analysis carried out by institutions of the National Coordinating System for Disaster Reduction (Gov't of Guatemala, 05 Sep 2017)According to the Seismology, Volcanology, Meteorology and Hydrology National Institute (INSIVUMEH), heavy rainfall on 18 September of 2017, caused floodings throughout Guatemala, particularly in the north-western region of the country. Floods were registered in the municipalities of San Felipe, Santa Cruz Muluá, San Martín Zapotitlán, Mazatenango’s urban centre, Colotenango’s urban centre, Calle de la Cruz, Callejón 10, Campo Borrayo, and the cantons of Icán, La otra banda and Tulula, among other areas. When the Guatemalan Red Cross Damage Analysis and Needs Assessment (DANA) teams were deployed to the departments of Retalhuleu and Suchitepéquez, the departmental delegate from CONRED reported that the flooding affected 629 people, forced 164 people to evacuate from their homes and 97 people to seek shelter in collective centres, damaged 68 roads and impacted 1 bridge in the departments of Retalhuleu and Suchitepéquez.In the departments of Suchitepéquez and Retalhuleu, floods have damaged homes, crops and household goods. Around 2,016 families are affected according to local authorities.The flood-stricken families preferred to find their own shelter since the collective centres assigned by local authorities do not have electricity, running water, toilets, showers or kitchens, and are far away from people’s homes; the loss of bedding, clothing, blankets and the necessary tools for their livelihoods, among other items has also prompted affected people to seek their own shelter to safeguard the few belongings they still have left.Local authorities have declared an orange level for the departments of Retalhuleu and Suchitepéquez to be able to provide emergency assistance to the affected areas, and on September 27 2017, CONRED declared Red Alert in Retalhuleu and Suchitepéquez, to provide assistance to the local emergencies.  (IFRC, 2 Oct 2017)Continuous rains have fallen in the department of Alta Verapaz for the entire month of October 2017, affecting 62 rural and urban communities in 8 municipalities due to increased water levels and the overflow of the Cahabón, Chixoy, Icbolay and Polochic Rivers.The heavy rains that continue to pound the area are compounded by the presence of an easterly wave, the arrival of Tropical Storm Selma, increased humidity saturation levels and swollen rivers that threaten to impact further already flooded areas. As of 31 October 2017, 13 collective centres have been opened to house more than 999 people, whose homes were directly affected.Alta Verapaz is one of the largest maize producers in Guatemala, accounting for 10 per cent of the total production in the country; however, crops are being lost to the flooding, which puts small and medium-sized farmers’ food security at risk for the next few months, according to information provided by the Guatemalan Red Cross (GRC) branch in Cobán. Per official reports, 450 hectares owned by 1,097 families have been affected in the municipality of Chisec, Raxruhá and Panzós. (IFRC, 10 Nov 2017)On 7 December, following the floods caused by Guatemala’s exceptionally strong rain season, the European Commission is providing €90 000 in humanitarian aid to assist 3500 people in the central Alta Verapaz department. (ECHO, 7 Dec 2017)ResumenA partir del mes de abril en algunas regiones del país se estableció la temporada de lluvias 2017 y hasta el momento el Sistema de la Coordinadora Nacional para la Reducción de Desastres –CONRED-, ha dado respuesta a 142 incidentes que han afectado directa e indirectamente a 144 mil 415 personas a nivel nacional.En 20 departamentos del país se han activado procedimientos en atención de las personas afectadas –solo Santa Rosa y Chimaltenango no han reportado incidentes mayores-. Los departamentos en donde se han registrado incidentes por la temporada de lluvias son Guatemala con 18 incidentes; Quiché con 17 incidentes; así como 10 incidentes en San Marcos, 10 en Huehuetenango y otros 10 en el departamento de Jutiapa. Los incidentes ocurridos son inundaciones, deslizamientos y derrumbes.La temporada de lluvias finalizará en el mes de noviembre pero al momento se reportan las 144 mil 415 personas afectadas, mil 470 evacuados, 938 damnificados, 667 personas se han albergado y se reportan 16 personas fallecidas en la actual temporada de lluvias 2017. (Gov't of Guatemala, 03 Jul 2017)Durante el fin de semana (2-3 de septiembre), se registraron inundaciones en los departamentos de Alta Verapaz, Petén y Suchitepéquez, reportándose 2 mil 246 personas afectadas y daños en 438 viviendas, según evaluaciones de daños y análisis de necesidades que realizaron instituciones del Sistema de la Coordinadora Nacional para la Reducción de Desastres (Gov't of Guatemala, 05 Sep 2017)De acuerdo con los últimos datos proporcionados por la Conred, las lluvias van dejando en todo el país 27 muertos, 4 desaparecidos y 26 heridos.370.468 guatemaltecos resultaron afectados y de ellos 7.594 fueron damnificados por pérdidas materiales o humanas. Como consecuencia de las diferentes emergencias, 22.537 personas debieron ser evacuadas, de las cuales 5.844 obtuvieron refugio en los diferentes albergues habilitados en las áreas más impactadas del país.En infraestructura, las lluvias causaron daños en 130 carreteras, 3 de las cuales resultaron destruidas. También hay 27 puentes afectados y 17 de ellos destruidos. A esto se suma 609 escuelas afectadas y 4.266 viviendas con daños, de las cuales 198 presentan daño severo (inhabitables). (Gov't of Guatemala, 14 Oct 2017)
El 11 de diciembre, la Unión Europea (UE) destinó 90.00 euros (unos 106.443 dólares) para atender las necesidades más urgentes de las familias guatemaltecas que resultaron afectadas por las torrenciales lluvias de los últimos meses. (Gov't of Guatemala, 11 Dec 2017)",https://reliefweb.int/disaster/fl-2017-000130-gtm
Sri Lanka: Floods and Landslides ,May,2017,Past Disaster,Flood1 more,Sri Lanka,"Incessant rains during the past 48 hours across Sri Lanka has affected over half a million people in 7 districts. Most affected was the Rathnapura district where over 20,000 people faced flash floods. In Galle, Neluwa, Tawalama, Niyagama, Baddegama areas were flooded. (Sri Lanka Red Cross Society, 26 May 2017)The most severely impacted district is Galle, where 142,149 people (36,314 families) have reportedly been affected. Fatalities have been reported in Gampaha, Galle, Hambantota, Kalutara, Kegalle, Matara and Ratnapura districts, with 46 deaths reported in Ratnapura alone...The UN received an initial request from the Government on 26 May 2017 related to search and rescue efforts. UN agencies are currently supporting the Government’s relief efforts in coordination and mobilizing resources...UNICEF will donate water containers, water purification tablets and tarpaulin sheets to the Disaster Management Centre (DMC). WHO will be supporting the Ministry of Health to deploy medical teams to the affected districts. WFP and UNDP are supporting the DMC with information management. UN OCHA will provide additional human resources for coordination with Government and Humanitarian Partners. Search and Rescue efforts are on standby from neighbouring countries and can be deployed if needed. (United Nations Sri Lanka, 27 May 2017)It is estimated that at least 150,000 are women and girls of reproductive age and over 189,000 children are affected by the disaster. To complement the ongoing Government-led response, the HCT is seeking US$22.7 million to address the critical life-saving and protection needs of 374,000 people in seven districts from 1 June to 31 October 2017. (UNRC Office, 2 Jun 2017)The UN Central Emergency Response Fund has allocated up to US$4 million to address the critical emergency shelter and non-food item, water, sanitation and hygiene, health and food security needs of 120,000 people in Galle, Matara, Kalutara and Ratnapura districts. The Ministry of National Policies and Economic Affairs is currently carrying out needs assessments to plan for mid-to-long term recovery for the affected areas. (OCHA, 12 Jun 2017)As of 21 June (1200hrs, UTC+5:30), an estimated 415,600 people are affected in 12 districts, of which approximately 30% are children according to UNICEF. A total of 213 deaths have been confirmed and 76 people remain missing. Over 3,000 houses have been destroyed and 21,000 are partially damaged. Just over 3,400 people remain temporarily displaced in 73 safe locations in affected districts. (UNRC Office, 22 Jun 2017)There is an increase in the number of dengue cases in Sri Lanka this year...Thecurrent dengue outbreakfollows, which affected 600 000 people in 15 of the 25 districts in the country. (WHO, 11 Jul 2017)Since the launch of the Humanitarian Country Team (HCT) Emergency Response Plan, the Disaster Management Centre has confirmed that 213 people have been killed as a result of flooding and landslides caused by heavy rainfall and strong monsoon winds that hit on 25 and 26 May 2017. Humanitarian needs include access to safe, clean water for drinking and household use. Ensuring the safety of temporary shelters for displaced people remains a key priority. Humanitarian agencies continue to work alongside local partners to address the needs of affected communities. (UN RC, 10 Aug 2017)As of 26 August, as many as 971 people remained displaced in 17 safe locations across three districts (Kalutara, Hambantota, and Ratnapura). (WHO, 28 Aug 2017)",https://reliefweb.int/disaster/fl-2017-000057-lka
Thailand: Floods ,May,2017,Past Disaster,Flash Flood1 more,Thailand,"High rainfall intensity has caused flood and flash floods in the northern provinces. Seven provinces and 61 villages were affected. In Kamphaeng Pet, the worst affected province, 800 houses were damaged. Meanwhile, 2,000 families in Uttaradit province were urged to evacuate to safer places due to the situation. In total, 853 houses were reportedly affected in province of Kamphaeng Pet, Uttaradit, Chiang Mai, Phitsanulok, Lampang, Loei and Udon Thani.  Twister hit Takhli district, Nakhon Sawan province, damaging 27 houses and 89 electric poles. (ASEAN - 21 May 2017)Uthai Thani’s Royal Irrigation Department (RID) office ordered that the Wang Romklao Dam open all three of its floodgates to release water into the Chao Phraya River so that it could take on more upstream water deposited by recent rains. A 24-hour flood watch was called in the area as water levels had risen to critical heights. (Govt. of Thailand, 12 June 2017)Meanwhile, the Meteorological Department warned that all areas of the nation would see thunderstorms and showers with Lopburi hit by runoff after a heavy bout of rain. The Royal Irrigation Department (RID) Office 10 joined military units in Lopburi to setup water barriers along the Phon Thong canal in Baan Mie district of the province in response to forest runoff that has swelled the waterway and resulted in flooding of some farms and residences. (Govt. of Thailand, 22 June 2017)Heavy rain affected several areas of the country over the past week, especially the northeastern provinces, causing floods and flash floods. At least 1,300 people had been displaced and 160,210 people had been affected in 16 provinces. Locally heavy to very heavy rain was forecast to occur over the north and northeast area of the country, including the ones already affected. (ECHO, 24 July 2017)Flooding in 18 districts of the Sakon Nakhon province of the Northeast was still causing anxiety and serious problems, according to the provincial disaster prevention and mitigation office. In Kalasin province, the flooding had inundated 439 villages in 70 tambons across 15 districts, affecting more than 10,000 households. Eleven districts had been declared disaster zones.(Bangkok Post, 30 Jul 2017)DDPM declared 11 provinces as disaster affected areas. Forty-four (44) provinces were affected and inundated by the monsoon. The affected areas covered 289 districts, 1,147 sub-districts, 10,487 villages, 43 communities. Twenty-seven (27) people reported death. Ten (10) provinces remain inundated with 274,512 families and 837,896 people affected. Meanwhile recovery process was undergoing in 34 provinces. The impact of the flooding was within the capacity of the government. There was no international assistance request at the moment. (ASEAN - 5 Aug 2017)According to DDPM, the flood situation had eased in 35 provinces. The other nine affected provinces, eight in the Northeast and one on the Central Plain, remained flooded. As a consequence of flooding, a total of 578,814 households in 12,949 villages were affected and 29 people had died. A total of 4,129 houses, 2,055 roads, 14,097 fish ponds, and over 3 million rai of agricultural land were damaged. Irrigation officials installed 22 water jet propulsion drives across the Moon River at a bridge in Ubon Ratchathani to speed up the rate of discharge into the Mekong River, as a large volume of runoff from other flooded areas was expected to flow into the province through the Moon River.(Bangkok Post, 9 Aug 2017)Flooding was reported in the northern province of Tak with at least 29 houses in Ban Rom Klao Sahamit in tambon Khiri Rat of Phrop Phra district hit by flash floods after heavy and continual rain. The flooding left a thick layer of mud on the main road of the village, rendering it impassible. Meanwhile, in Prachin Buri, a village at the foot of a hill in Prachantakham district, was hit by a flash flood after hours of torrential rain. The water ranged from 1m to 3m deep and continued to rise as rescuers arrived to evacuate residents.(Bangkok Post, 29 Aug 2017)People in five provinces were battling prolonged floods, according to the Disaster Prevention and Mitigation Department (DDPM). The latest DDPM report said nearly 3,000 families in 23 districts of Kalasin, Roi Et, Ubon Ratchathani, Yasothon, and Ayutthaya remained in need of assistance. About 10,000 people in those areas were struggling to go about their daily lives. The department had already contacted responsible agencies in the affected areas about providing assistance measures and urged officials in the provinces where the water had subsided to conduct detailed damage assessments, so that the government instigated post-flood assistance programs accordingly.(Govt. of Thailand, 3 Sep 2017)Flooding had continued to impact several areas of the nation. More than 300 rai of farmland in Khon Kaen had been hit with flooding and local administrators had been ordered to survey damages. Clean up efforts were underway in Ang Thong while over 700 households in three districts of the province were still contending with floodwaters. Royal Irrigation Department (RID) would begin using farmland to take on some 1.5 billion cubic meters of water but assured the process would not cause unwanted flooding. The waters were to be pushed to sea from September 30.(Govt. of Thailand, 12 Sep 2017)Heavy thunderstorms have triggered severe flooding in ten southern provinces. Satun province has taken the biggest hit, with floodwater was as high as 30 centimeters in the capital district. Meanwhile, in Phichit province, the level of water in the Nan River running through the city’s center, Taphan Hin, and Bang Mun Nak districts has increased at an alarming rate. Local officers say if the water level increases another 40 centimeters, the situation will be critical.The Meteorological Department has reported that southern provinces will continue to experience thundershowers and gusty winds.(Govt. of Thailand, 24 Sep 2017)In early October, the heaviest rains recorded in 30 years in Phichit province left much of the region inundated and a section of the Nan River swollen to within 20 centimeters of its banks, resulting in widespread flooding of the province. In Ayuthaya province, Governor Sujin Chaichumsak has held a meeting on disaster prevention and mitigation after rains across 6 districts raised water levels to worrying levels. The Meteorological Department forecast harsh weather to continue for the coming week and maintained flood warnings.(Govt. of Thailand, 5 Oct 2017)Continuous rainfall has triggered heavy flooding in two communities of Uthai Thani Province. Torrential rain caused water in Khlong Pho Reservoir to overflow, causing floods in Phai Khiao and Bo Yang sub-districts of Uthai Thani province. The water level in these communities was reportedly as high as 80 centimeters, damaging roads and compromising several plantation operations. The Department of Disaster Prevention and Mitigation has reported that rapid flooding has swept Lopburi and Kamphaeng Phet provinces, putting 646 homes under water.(Govt. of Thailand, 8 Oct 2017)Five people have been killed following the runoff and river overflows in nine Central provinces that affected 140,000 people over the past three days, authorities said on 14 October 2017. Heavy rain from Oct 10-13, a result of a depression and discharge from the Chao Phraya Dam, triggered runoff and overflows in Lop Buri, Kamphaeng Phet, Sing Buri, Ang Thong, Ayutthaya, Nakhon Sawan, Chai Nat, Tak and Phichit. Chayaphol Thitisak, director-general of the Department of Disaster Prevention & Mitigation (DDPM), said 51,669 households in 32 districts were affected.(Bangkok Post, 15 Oct 2017)In the early hours of 14 October, the amount of rainwater that fell exceeded 200mm in many areas. In total, 55 spots were inundated, causing widespread damage to homes and assets. More torrential downpours is expected in the lower Central region including Bangkok over the next few days because of a monsoon.(Bangkok Post, 17 Oct 2017)Flooding persists in 17 provinces, mostly in the Central Plains, but the water will start to recede within a week, according to authorities. Floodwater in the 17 provinces affected about 296,000 people in 2,409 villages and 20 families had to be evacuated. DDPM reported that from Oct 10 to 28, flooding had affected about 325,000 people in 23 provinces and killed 10.(Bangkok Post, 28 Oct 2017)Heavy rain and floods ravaged many parts of the South, particularly Nakhon Si Thammarat and Phatthalung provinces, affecting many people and damaging homes and farms. Hospitals in the 10 affected provinces were told to brace for flash floods resulting from the influence of Typhoon Damrey. According to DDPM, 126,390 households in 79 districts had been affected by flooding from the heavy rain and discharges during Oct 10 to Nov 4.(Bangkok Post, 5 Nov 2017)Eleven provinces in Thailand remain flooded while people in the southern region have been warned of further heavy rains and gusty winds. According to the Ministry of the Interior, eleven provinces that are still under water include Phichit, Nakhon Sawan, Sing Buri, Ang Thong, Ayutthaya, Suphan Buri, Nong Bua Lamphu, Khon Kaen, Maha Sarakham, Kalasin, and Roi Et. A total of 88,227 households are affected by the widespread inundation..(Govt. of Thailand, 11 Nov 2017)On Tuesday, November 14, heavy rains triggered flash floods that hit parts of the five southern provinces of Krabi, Surat Thani, Songkhla, Phatthalung and Yala the following day, affecting thousands of people. In Songkhla, at least two schools in Hat Yai district, the province's main business centre, were forced to shut for two days following the floods. Meanwhile, over 500 houses were flooded in Yala.  Floodwaters have since receded and the water level of the Chao Phraya river read 23cm on November 15 -- well below the critical point of 6.5m. The Bangkok Post reports that water level measurements conducted at other water checkpoints also suggested that water levels in this main river of the region are decreasing(Bangkok Post, 16 Nov 2017)",https://reliefweb.int/disaster/fl-2017-000053-tha
Burkina Faso: Floods ,May,2017,Past Disaster,Flood,Burkina Faso,"Floods and violent winds have killed three people, injured 18 others and destroyed more than 750 houses across the country since the beginning of May. Overall, 5,129 people have been affected in several localities in the country’s East and South-Western regions. (OCHA, 22 May 2017)",https://reliefweb.int/disaster/fl-2017-000054-bfa
Russian Federation: Floods ,May,2017,Past Disaster,Flood,Russia,"Between 10 and 15 May 2017, the destruction of the dam in the district of Ishim (Tyumen region) and water spills across the Ishim river caused massive flooding throughout Tyumen region, in particular, around the town of Ishim. The dam was destroyed due to the huge amount of melting snow and the discharge of water from the reservoir near the city of Petropavlovsk in Kazakhstan. The total number of affected families in Ishim district is to date 1,045. More than 130 houses are waterlogged and damaged and 41 houses fully destroyed. (IFRC, 23 May 2017)On 23-24 May 2017, heavy flooding occurred in two additional regions – Omsk and Stavropol Kray – in Russia, following earlier floods in Tyumen region. As a result, the total number of affected people in the three regions of Omsk, Stavropol Kray and Tyumen has grown from 1,600 to 15,721 people (including 1,479 children and 668 elderly). The number of worst-affected people is amounting to 4,500 residents in 2,545 families. (IFRC, 12 Jun 2017)On 16 June, The Russian Government informed that 937 million 500 thousand rubles would be allocated from the reserve fund to the Stavropol Territory authorities to pay for lump-sums and compensations. All compensations would come from federal reserve funds, while more than 12.3 thousand the affected people have received more than 163.5 million rubles from the regional budget.(Gov't of Russia, 16 Jun 2017)",https://reliefweb.int/disaster/fl-2017-000052-rus
